SQL
---

Structured query language

we can define command in sql for dbms.
This command will be executed by DBMS/databse server.
there are main three types of sql commands:

1)DDL(Data definition language):these are the commands inside DDL create,alter,drop
2)DML(Data manupulation language):insert,delete,update
3)DQL(Data query language):select

1)Command To show Database
--------------------------

show databases;


mysql> show databases;
+--------------------+
| Database           |
+--------------------+
| abc                |
| information_schema |
| mysql              |
| performance_schema |
| selfdatabase       |
| sys                |
+--------------------+
6 rows in set (2.34 sec)


2)Command to create Database
------------------------------

create database abc;


mysql> create database software;
Query OK, 1 row affected (5.56 sec)

3)Command to delete Database
------------------------------
drop database abc;

mysql> drop database software;
Query OK, 0 rows affected (0.83 sec)




4)Command to use database
--------------------------
use databasename;

use abc;

mysql> use software;
Database changed

5)Command to create table in database
----------------------------------------
create table softwareinfo(softwareid int primary key,firstname varchar(30),lastname varchar(30),phone varchar(20),age int);

ex:
mysql> create table softwareinfo(softwareid int primary key,firstname varchar(30),lastname varchar(30),phone varchar(20),age int);
Query OK, 0 rows affected (15.57 sec)


6)Command to Show tables;
--------------------------
show tables;


mysql> show tables;
+--------------------+
| Tables_in_software |
+--------------------+
| softwareinfo       |
+--------------------+
1 row in set (0.71 sec)


7)Command to insert data into table
------------------------------------
insert into softwareinfo(softwareid,firstname,lastname,phone,age) values(101,'Kanhaiya','Kumar','9572431005',25);

					OR

 insert into softwareinfo values(102,'Manish','Kumar','9031551857',22);
Query OK, 1 row affected (4.34 sec)



ex:
insert into softwareinfo(softwareid,firstname,lastname,phone,age) values(101,'Kanhaiya','Kumar','9572431005',25);
Query OK, 1 row affected (1.48 sec)


8)To show the data inside the table
------------------------------------
select * from tablename;

ex:

mysql> select * from softwareinfo;
+------------+-----------+----------+------------+------+
| softwareid | firstname | lastname | phone      | age  |
+------------+-----------+----------+------------+------+
|        101 | Kanhaiya  | Kumar    | 9572431005 |   25 |
|        102 | Manish    | Kumar    | 9031551857 |   22 |
+------------+-----------+----------+------------+------+
2 rows in set (0.00 sec)

9)To Show particular column of data from the table
---------------------------------------------------
select firstname,lastname,phone from softwareinfo;


mysql> select firstname,lastname,phone from softwareinfo;
+-----------+----------+------------+
| firstname | lastname | phone      |
+-----------+----------+------------+
| Kanhaiya  | Kumar    | 9572431005 |
| Manish    | Kumar    | 9031551857 |
+-----------+----------+------------+
2 rows in set (0.00 sec)

10)To show a single data from the table
-----------------------------------------
select * from softwareinfo where softwareid=102;


mysql> select * from softwareinfo where softwareid=102;
+------------+-----------+----------+------------+------+
| softwareid | firstname | lastname | phone      | age  |
+------------+-----------+----------+------------+------+
|        102 | Manish    | Kumar    | 9031551857 |   22 |
+------------+-----------+----------+------------+------+
1 row in set (0.11 sec)

			or
select * from softwareinfo where firstname=kanhaiya;

mysql> select * from softwareinfo where firstname='kanhaiya';
+------------+-----------+----------+------------+------+
| softwareid | firstname | lastname | phone      | age  |
+------------+-----------+----------+------------+------+
|        101 | Kanhaiya  | Kumar    | 9572431005 |   25 |
+------------+-----------+----------+------------+------+
1 row in set (0.00 sec)


few entries of data in the table;


11)Command to sort the elements in the table and show
------------------------------------------------------

select * from softwareinfo where age>18;


mysql> select * from softwareinfo where age>18;
+------------+-----------+----------+------------+------+
| softwareid | firstname | lastname | phone      | age  |
+------------+-----------+----------+------------+------+
|        101 | Kanhaiya  | Kumar    | 9572431005 |   25 |
|        102 | Manish    | Kumar    | 9031551857 |   22 |
|        103 | Raja      | Kumar    | 8863836352 |   21 |
|        106 | shweta    | kumari   | 5678455623 |   20 |
+------------+-----------+----------+------------+------+
4 rows in set (0.00 sec)

12)Command to sort the elements in the using between keyword
------------------------------------------------------------
select * from softwareinfo where age between 20 and 25;

mysql> select * from softwareinfo where age between 20 and 25;
+------------+-----------+----------+------------+------+
| softwareid | firstname | lastname | phone      | age  |
+------------+-----------+----------+------------+------+
|        101 | Kanhaiya  | Kumar    | 9572431005 |   25 |
|        102 | Manish    | Kumar    | 9031551857 |   22 |
|        103 | Raja      | Kumar    | 8863836352 |   21 |
|        106 | shweta    | kumari   | 5678455623 |   20 |
+------------+-----------+----------+------------+------+
4 rows in set (0.00 sec)

			or
mysql> select * from softwareinfo where age>=18 and age<=28;
+------------+-----------+----------+------------+------+
| softwareid | firstname | lastname | phone      | age  |
+------------+-----------+----------+------------+------+
|        101 | Kanhaiya  | Kumar    | 9572431005 |   25 |
|        102 | Manish    | Kumar    | 9031551857 |   22 |
|        103 | Raja      | Kumar    | 8863836352 |   21 |
|        106 | shweta    | kumari   | 5678455623 |   20 |
+------------+-----------+----------+------------+------+
4 rows in set (0.00 sec)

13)Command to show the firstname starts with the letter s
---------------------------------------------------------
select * from softwareinfo where firstname like 's%';

mysql> select * from softwareinfo where firstname like 's%';
+------------+------------+----------+------------+------+
| softwareid | firstname  | lastname | phone      | age  |
+------------+------------+----------+------------+------+
|        106 | shweta     | kumari   | 5678455623 |   20 |
|        107 | sweet      | kumari   | 5675665623 |   28 |
|        108 | sweetheart | king     | 5675665623 |   28 |
+------------+------------+----------+------------+------+
3 rows in set (0.03 sec)

14)Command to show the lastname ends with i

select * from softwareinfo where lastname like '%i';

mysql> select * from softwareinfo where lastname like '%i';
+------------+-----------+----------+------------+------+
| softwareid | firstname | lastname | phone      | age  |
+------------+-----------+----------+------------+------+
|        106 | shweta    | kumari   | 5678455623 |   20 |
|        107 | sweet     | kumari   | 5675665623 |   28 |
+------------+-----------+----------+------------+------+
2 rows in set (0.00 sec)

15)command to sort the elements in the table according to the number of words
------------------------------------------------------------------------------
select * from softwareinfo where firstname like '____';

mysql> select * from softwareinfo where firstname like '____';
+------------+-----------+----------+------------+------+
| softwareid | firstname | lastname | phone      | age  |
+------------+-----------+----------+------------+------+
|        103 | Raja      | Kumar    | 8863836352 |   21 |
+------------+-----------+----------+------------+------+
1 row in set (0.00 sec)


16)Command to sort according to the maximum value for this we need to make subquery.
-----------------------------------------------------------------------------------

select * from softwareinfo where age=(select max(age) from softwareinfo);

mysql> select * from softwareinfo where age=(select max(age) from softwareinfo);
+------------+------------+----------+------------+------+
| softwareid | firstname  | lastname | phone      | age  |
+------------+------------+----------+------------+------+
|        107 | sweet      | kumari   | 5675665623 |   28 |
|        108 | sweetheart | king     | 5675665623 |   28 |
+------------+------------+----------+------------+------+
2 rows in set (0.02 sec)

17)Command to sort according to the minimum value for this we need to make subquery.
-----------------------------------------------------------------------------------

select * from softwareinfo where age=(select min(age) from softwareinfo);

mysql> select * from softwareinfo where age=(select min(age) from softwareinfo);
+------------+-----------+----------+------------+------+
| softwareid | firstname | lastname | phone      | age  |
+------------+-----------+----------+------------+------+
|        105 | Rajan     | Kumar    | 4568978568 |   15 |
+------------+-----------+----------+------------+------+
1 row in set (0.00 sec)

18)Command to delete a data from the table 
===========================================

delete from softwareinfo where softwareid=106;

mysql> delete from softwareinfo where softwareid=106;
Query OK, 1 row affected (0.63 sec)

mysql> select * from softwareinfo;
+------------+------------+----------+------------+------+
| softwareid | firstname  | lastname | phone      | age  |
+------------+------------+----------+------------+------+
|        101 | Kanhaiya   | Kumar    | 9572431005 |   25 |
|        102 | Manish     | Kumar    | 9031551857 |   22 |
|        103 | Raja       | Kumar    | 8863836352 |   21 |
|        104 | Raushan    | Kumar    | 8956234578 |   17 |
|        105 | Rajan      | Kumar    | 4568978568 |   15 |
|        107 | sweet      | kumari   | 5675665623 |   28 |
|        108 | sweetheart | king     | 5675665623 |   28 |
+------------+------------+----------+------------+------+
7 rows in set (0.00 sec)


19)Command to update a query

update softwareinfo set lastname='khanna',phone='8888888888' where softwareid=102;

mysql> update softwareinfo set lastname='khanna',phone='8888888888' where softwareid=102;
Query OK, 1 row affected (0.42 sec)
Rows matched: 1  Changed: 1  Warnings: 0

mysql> select * from softwareinfo;
+------------+------------+----------+------------+------+
| softwareid | firstname  | lastname | phone      | age  |
+------------+------------+----------+------------+------+
|        101 | Kanhaiya   | Kumar    | 9572431005 |   25 |
|        102 | Manish     | khanna   | 8888888888 |   22 |
|        103 | Raja       | Kumar    | 8863836352 |   21 |
|        104 | Raushan    | Kumar    | 8956234578 |   17 |
|        105 | Rajan      | Kumar    | 4568978568 |   15 |
|        107 | sweet      | kumari   | 5675665623 |   28 |
|        108 | sweetheart | king     | 5675665623 |   28 |
+------------+------------+----------+------------+------+
7 rows in set (0.00 sec)
